{
  "season": 2012,
  "feature_set": "historical_v1",
  "feature_order": [
    "Seed",
    "WinPct",
    "SOS",
    "SOV",
    "selection_ordinal_last",
    "AdjOE_mean",
    "AdjDE_mean",
    "AdjNE_mean",
    "FG%_mean",
    "FG3%_mean",
    "FT%_mean"
  ],
  "teams": {
    "1102": {
      "Seed": 17.0,
      "WinPct": 0.407407,
      "SOS": 0.546826,
      "SOV": 0.396225,
      "selection_ordinal_last": 168.0,
      "AdjOE_mean": 96.206579,
      "AdjDE_mean": 97.739098,
      "AdjNE_mean": -1.532519,
      "FG%_mean": 0.445371,
      "FG3%_mean": 0.332277,
      "FT%_mean": 0.684464
    },
    "1103": {
      "Seed": 17.0,
      "WinPct": 0.65625,
      "SOS": 0.528704,
      "SOV": 0.465711,
      "selection_ordinal_last": 55.0,
      "AdjOE_mean": 102.930351,
      "AdjDE_mean": 96.831595,
      "AdjNE_mean": 6.098756,
      "FG%_mean": 0.462502,
      "FG3%_mean": 0.373544,
      "FT%_mean": 0.686506
    },
    "1104": {
      "Seed": 9.0,
      "WinPct": 0.65625,
      "SOS": 0.560274,
      "SOV": 0.521167,
      "selection_ordinal_last": 36.0,
      "AdjOE_mean": 108.383875,
      "AdjDE_mean": 82.686973,
      "AdjNE_mean": 25.696902,
      "FG%_mean": 0.454131,
      "FG3%_mean": 0.291759,
      "FT%_mean": 0.713127
    },
    "1105": {
      "Seed": 17.0,
      "WinPct": 0.192308,
      "SOS": 0.425705,
      "SOV": 0.282529,
      "selection_ordinal_last": 342.0,
      "AdjOE_mean": 79.841891,
      "AdjDE_mean": 122.92536,
      "AdjNE_mean": -43.083469,
      "FG%_mean": 0.404989,
      "FG3%_mean": 0.315083,
      "FT%_mean": 0.656526
    },
    "1106": {
      "Seed": 17.0,
      "WinPct": 0.344828,
      "SOS": 0.424663,
      "SOV": 0.239392,
      "selection_ordinal_last": 308.0,
      "AdjOE_mean": 78.317059,
      "AdjDE_mean": 114.219415,
      "AdjNE_mean": -35.902356,
      "FG%_mean": 0.376197,
      "FG3%_mean": 0.299003,
      "FT%_mean": 0.573048
    },
    "1107": {
      "Seed": 17.0,
      "WinPct": 0.575758,
      "SOS": 0.42698,
      "SOV": 0.262585,
      "selection_ordinal_last": 214.0,
      "AdjOE_mean": 103.700657,
      "AdjDE_mean": 115.646092,
      "AdjNE_mean": -11.945436,
      "FG%_mean": 0.448456,
      "FG3%_mean": 0.359593,
      "FT%_mean": 0.754574
    },
    "1108": {
      "Seed": 17.0,
      "WinPct": 0.25,
      "SOS": 0.421852,
      "SOV": 0.300047,
      "selection_ordinal_last": 335.0,
      "AdjOE_mean": 79.446452,
      "AdjDE_mean": 120.018459,
      "AdjNE_mean": -40.572008,
      "FG%_mean": 0.409722,
      "FG3%_mean": 0.315245,
      "FT%_mean": 0.68424
    },
    "1110": {
      "Seed": 17.0,
      "WinPct": 0.645161,
      "SOS": 0.446,
      "SOV": 0.369243,
      "selection_ordinal_last": 141.0,
      "AdjOE_mean": 100.562909,
      "AdjDE_mean": 103.125551,
      "AdjNE_mean": -2.562642,
      "FG%_mean": 0.430984,
      "FG3%_mean": 0.421761,
      "FT%_mean": 0.700048
    },
    "1111": {
      "Seed": 17.0,
      "WinPct": 0.37931,
      "SOS": 0.476166,
      "SOV": 0.437527,
      "selection_ordinal_last": 258.0,
      "AdjOE_mean": 97.899146,
      "AdjDE_mean": 108.931392,
      "AdjNE_mean": -11.032246,
      "FG%_mean": 0.441978,
      "FG3%_mean": 0.348201,
      "FT%_mean": 0.654603
    },
    "1112": {
      "Seed": 17.0,
      "WinPct": 0.676471,
      "SOS": 0.51598,
      "SOV": 0.444587,
      "selection_ordinal_last": 76.0,
      "AdjOE_mean": 110.051683,
      "AdjDE_mean": 90.488707,
      "AdjNE_mean": 19.562976,
      "FG%_mean": 0.439727,
      "FG3%_mean": 0.374325,
      "FT%_mean": 0.697438
    },
    "1113": {
      "Seed": 17.0,
      "WinPct": 0.322581,
      "SOS": 0.518139,
      "SOV": 0.413714,
      "selection_ordinal_last": 252.0,
      "AdjOE_mean": 97.897551,
      "AdjDE_mean": 101.563049,
      "AdjNE_mean": -3.665497,
      "FG%_mean": 0.455928,
      "FG3%_mean": 0.374936,
      "FT%_mean": 0.664681
    },
    "1114": {
      "Seed": 17.0,
      "WinPct": 0.466667,
      "SOS": 0.500335,
      "SOV": 0.415881,
      "selection_ordinal_last": 175.0,
      "AdjOE_mean": 93.86028,
      "AdjDE_mean": 98.784834,
      "AdjNE_mean": -4.924553,
      "FG%_mean": 0.400149,
      "FG3%_mean": 0.330214,
      "FT%_mean": 0.698658
    },
    "1115": {
      "Seed": 17.0,
      "WinPct": 0.333333,
      "SOS": 0.438603,
      "SOV": 0.316019,
      "selection_ordinal_last": 302.0,
      "AdjOE_mean": 83.995139,
      "AdjDE_mean": 120.372399,
      "AdjNE_mean": -36.37726,
      "FG%_mean": 0.415078,
      "FG3%_mean": 0.296869,
      "FT%_mean": 0.632281
    },
    "1116": {
      "Seed": 17.0,
      "WinPct": 0.5625,
      "SOS": 0.543934,
      "SOV": 0.513029,
      "selection_ordinal_last": 114.0,
      "AdjOE_mean": 103.886574,
      "AdjDE_mean": 95.663271,
      "AdjNE_mean": 8.223303,
      "FG%_mean": 0.435612,
      "FG3%_mean": 0.357306,
      "FT%_mean": 0.690202
    },
    "1117": {
      "Seed": 17.0,
      "WinPct": 0.393939,
      "SOS": 0.499396,
      "SOV": 0.368352,
      "selection_ordinal_last": 222.0,
      "AdjOE_mean": 96.016045,
      "AdjDE_mean": 105.105957,
      "AdjNE_mean": -9.089912,
      "FG%_mean": 0.426414,
      "FG3%_mean": 0.376391,
      "FT%_mean": 0.660876
    },
    "1119": {
      "Seed": 17.0,
      "WinPct": 0.37931,
      "SOS": 0.439541,
      "SOV": 0.221343,
      "selection_ordinal_last": 301.0,
      "AdjOE_mean": 92.719418,
      "AdjDE_mean": 108.705424,
      "AdjNE_mean": -15.986006,
      "FG%_mean": 0.416808,
      "FG3%_mean": 0.361635,
      "FT%_mean": 0.729309
    },
    "1120": {
      "Seed": 17.0,
      "WinPct": 0.483871,
      "SOS": 0.540111,
      "SOV": 0.43574,
      "selection_ordinal_last": 145.0,
      "AdjOE_mean": 98.58838,
      "AdjDE_mean": 92.05496,
      "AdjNE_mean": 6.53342,
      "FG%_mean": 0.41809,
      "FG3%_mean": 0.301816,
      "FT%_mean": 0.635023
    },
    "1122": {
      "Seed": 17.0,
      "WinPct": 0.354839,
      "SOS": 0.527006,
      "SOV": 0.381969,
      "selection_ordinal_last": 192.0,
      "AdjOE_mean": 98.625682,
      "AdjDE_mean": 105.526914,
      "AdjNE_mean": -6.901233,
      "FG%_mean": 0.447386,
      "FG3%_mean": 0.324867,
      "FT%_mean": 0.668678
    },
    "1123": {
      "Seed": 17.0,
      "WinPct": 0.482759,
      "SOS": 0.438584,
      "SOV": 0.304065,
      "selection_ordinal_last": 256.0,
      "AdjOE_mean": 99.721956,
      "AdjDE_mean": 103.691815,
      "AdjNE_mean": -3.969859,
      "FG%_mean": 0.424802,
      "FG3%_mean": 0.338026,
      "FT%_mean": 0.687903
    },
    "1124": {
      "Seed": 3.0,
      "WinPct": 0.787879,
      "SOS": 0.570608,
      "SOV": 0.531324,
      "selection_ordinal_last": 8.0,
      "AdjOE_mean": 113.882717,
      "AdjDE_mean": 88.533633,
      "AdjNE_mean": 25.349083,
      "FG%_mean": 0.466836,
      "FG3%_mean": 0.370578,
      "FT%_mean": 0.745847
    },
    "1125": {
      "Seed": 14.0,
      "WinPct": 0.787879,
      "SOS": 0.47199,
      "SOV": 0.41616,
      "selection_ordinal_last": 58.0,
      "AdjOE_mean": 120.998805,
      "AdjDE_mean": 97.143904,
      "AdjNE_mean": 23.854901,
      "FG%_mean": 0.480479,
      "FG3%_mean": 0.380136,
      "FT%_mean": 0.728549
    },
    "1126": {
      "Seed": 17.0,
      "WinPct": 0.484848,
      "SOS": 0.438606,
      "SOV": 0.304315,
      "selection_ordinal_last": 239.0,
      "AdjOE_mean": 94.221913,
      "AdjDE_mean": 116.010024,
      "AdjNE_mean": -21.788111,
      "FG%_mean": 0.438913,
      "FG3%_mean": 0.359324,
      "FT%_mean": 0.648682
    },
    "1127": {
      "Seed": 17.0,
      "WinPct": 0.064516,
      "SOS": 0.451363,
      "SOV": 0.404902,
      "selection_ordinal_last": 344.0,
      "AdjOE_mean": 80.332542,
      "AdjDE_mean": 119.987162,
      "AdjNE_mean": -39.65462,
      "FG%_mean": 0.398085,
      "FG3%_mean": 0.299356,
      "FT%_mean": 0.709649
    },
    "1129": {
      "Seed": 17.0,
      "WinPct": 0.413793,
      "SOS": 0.537112,
      "SOV": 0.377096,
      "selection_ordinal_last": 173.0,
      "AdjOE_mean": 107.629396,
      "AdjDE_mean": 97.289648,
      "AdjNE_mean": 10.339748,
      "FG%_mean": 0.420001,
      "FG3%_mean": 0.339879,
      "FT%_mean": 0.683816
    },
    "1130": {
      "Seed": 17.0,
      "WinPct": 0.290323,
      "SOS": 0.542838,
      "SOV": 0.458847,
      "selection_ordinal_last": 244.0,
      "AdjOE_mean": 92.904095,
      "AdjDE_mean": 98.91665,
      "AdjNE_mean": -6.012555,
      "FG%_mean": 0.409786,
      "FG3%_mean": 0.33793,
      "FT%_mean": 0.667123
    },
    "1131": {
      "Seed": 17.0,
      "WinPct": 0.5,
      "SOS": 0.46804,
      "SOV": 0.340714,
      "selection_ordinal_last": 190.0,
      "AdjOE_mean": 93.615998,
      "AdjDE_mean": 105.100131,
      "AdjNE_mean": -11.484133,
      "FG%_mean": 0.424355,
      "FG3%_mean": 0.325277,
      "FT%_mean": 0.680353
    },
    "1132": {
      "Seed": 17.0,
      "WinPct": 0.5,
      "SOS": 0.504947,
      "SOV": 0.442546,
      "selection_ordinal_last": 158.0,
      "AdjOE_mean": 101.775635,
      "AdjDE_mean": 97.533771,
      "AdjNE_mean": 4.241864,
      "FG%_mean": 0.45388,
      "FG3%_mean": 0.347182,
      "FT%_mean": 0.680733
    },
    "1133": {
      "Seed": 17.0,
      "WinPct": 0.21875,
      "SOS": 0.54285,
      "SOV": 0.452331,
      "selection_ordinal_last": 265.0,
      "AdjOE_mean": 92.251367,
      "AdjDE_mean": 99.730159,
      "AdjNE_mean": -7.478792,
      "FG%_mean": 0.402351,
      "FG3%_mean": 0.293419,
      "FT%_mean": 0.679586
    },
    "1135": {
      "Seed": 17.0,
      "WinPct": 0.233333,
      "SOS": 0.480666,
      "SOV": 0.286898,
      "selection_ordinal_last": 313.0,
      "AdjOE_mean": 89.676943,
      "AdjDE_mean": 112.383309,
      "AdjNE_mean": -22.706366,
      "FG%_mean": 0.405282,
      "FG3%_mean": 0.36059,
      "FT%_mean": 0.614827
    },
    "1136": {
      "Seed": 17.0,
      "WinPct": 0.066667,
      "SOS": 0.476001,
      "SOV": 0.170115,
      "selection_ordinal_last": 340.0,
      "AdjOE_mean": 89.616813,